{
  "schema_version": "stage0.rev2",
  "workflow_id": "ecommerce_growth_pack",
  "display_name": "Ecommerce Growth Pack",
  "required_inputs": [
    {
      "key": "product_name",
      "label": "Product name",
      "type": "text",
      "required": true
    },
    {
      "key": "product_image",
      "label": "Product image",
      "type": "file",
      "required": true
    },
    {
      "key": "target_channel",
      "label": "Target channel",
      "type": "enum",
      "required": true
    },
    {
      "key": "offer",
      "label": "Offer",
      "type": "text",
      "required": false
    }
  ],
  "clarification_questions": [
    "Which audience segment should the pack prioritize?",
    "Are there restricted claims or approved phrases for the product?"
  ],
  "four_option_taxonomy": [
    "conversion_offer",
    "social_proof",
    "feature_comparison",
    "retention_bundle"
  ],
  "required_package_outputs": [
    "hero_product_ad.png",
    "square_social_ad.png",
    "story_variant.png",
    "marketplace_banner.png",
    "manifest.json",
    "qa_report.json",
    "trace_provenance.json"
  ],
  "required_generated_assets": [
    {
      "asset_id": "hero_product_ad",
      "file_name": "hero_product_ad.png",
      "asset_kind": "image",
      "strategy_taxonomy": "conversion_offer",
      "export_target": "web_hero"
    },
    {
      "asset_id": "square_social_ad",
      "file_name": "square_social_ad.png",
      "asset_kind": "image",
      "strategy_taxonomy": "social_proof",
      "export_target": "social_square"
    },
    {
      "asset_id": "story_variant",
      "file_name": "story_variant.png",
      "asset_kind": "image",
      "strategy_taxonomy": "feature_comparison",
      "export_target": "social_story"
    },
    {
      "asset_id": "marketplace_banner",
      "file_name": "marketplace_banner.png",
      "asset_kind": "image",
      "strategy_taxonomy": "retention_bundle",
      "export_target": "marketplace_banner"
    }
  ],
  "required_qa_checks": [
    "file_integrity",
    "aspect_ratio",
    "duplicate_similarity",
    "four_option_distinctness",
    "product_logo_preservation"
  ],
  "required_safety_checks": {
    "enforcement_points": [
      "brief",
      "provider_request",
      "provider_response",
      "qa",
      "export"
    ],
    "linked_rule_domains": [
      "ip_brand"
    ],
    "linked_eval_fixtures": [
      "fx_brand_product_preservation"
    ]
  },
  "export_targets": [
    {
      "target_id": "zip_delivery",
      "format": "zip",
      "required_files": [
        "manifest.json",
        "assets/hero_product_ad.png",
        "assets/square_social_ad.png",
        "assets/story_variant.png",
        "assets/marketplace_banner.png",
        "metadata.json",
        "qa_report.json",
        "trace_provenance.json"
      ]
    }
  ],
  "negative_fixture_links": [
    {
      "fixture_id": "fx_ambiguous_brief_missing_product",
      "category": "ambiguous_brief",
      "expected_status": "blocked"
    },
    {
      "fixture_id": "fx_brand_product_preservation",
      "category": "brand_product_preservation",
      "expected_status": "blocked"
    }
  ],
  "api_smoke_contract": {
    "execution_status": "not_executed",
    "blueprint_checklist_remains_open": true,
    "operation_ids": [
      "createChatSession",
      "createChatMessage",
      "createCandidateSet",
      "listCandidateAssets",
      "selectDirection",
      "createPackage",
      "createExport",
      "getExport"
    ],
    "request_sequence": [
      {
        "step": 1,
        "operation_id": "createChatSession",
        "method": "post",
        "path_template": "/projects/{project_id}/chat/sessions",
        "requires_idempotency_key": true,
        "request_schema": "ChatSessionCreate",
        "success_status": "201",
        "response_schema": "ChatSession",
        "path_params": [
          "project_id"
        ],
        "body_assertions": [
          "title includes Ecommerce Growth Pack"
        ]
      },
      {
        "step": 2,
        "operation_id": "createChatMessage",
        "method": "post",
        "path_template": "/chat/sessions/{chat_session_id}/messages",
        "requires_idempotency_key": true,
        "request_schema": "ChatMessageCreate",
        "success_status": "202",
        "response_schema": "TaskStatus",
        "path_params": [
          "chat_session_id"
        ],
        "body_assertions": [
          "body contains product_name",
          "body contains target_channel",
          "references includes product_image upload"
        ]
      },
      {
        "step": 3,
        "operation_id": "createCandidateSet",
        "method": "post",
        "path_template": "/projects/{project_id}/candidate-sets",
        "requires_idempotency_key": true,
        "request_schema": "CandidateSetCreate",
        "success_status": "202",
        "response_schema": "TaskStatus",
        "path_params": [
          "project_id"
        ],
        "body_assertions": [
          "workflow_id equals ecommerce_growth_pack",
          "brief contains product_name, product_image, target_channel"
        ]
      },
      {
        "step": 4,
        "operation_id": "listCandidateAssets",
        "method": "get",
        "path_template": "/candidate-sets/{candidate_set_id}/assets",
        "requires_idempotency_key": false,
        "request_schema": "none",
        "success_status": "200",
        "response_schema": "CandidateAssetPage",
        "path_params": [
          "candidate_set_id"
        ],
        "body_assertions": [
          "response contains four candidate assets",
          "assets cover conversion_offer, social_proof, feature_comparison, retention_bundle"
        ]
      },
      {
        "step": 5,
        "operation_id": "selectDirection",
        "method": "put",
        "path_template": "/projects/{project_id}/selected-direction",
        "requires_idempotency_key": true,
        "request_schema": "SelectedDirectionCreate",
        "success_status": "200",
        "response_schema": "SelectedDirection",
        "path_params": [
          "project_id"
        ],
        "body_assertions": [
          "candidate_asset_id references selected ecommerce candidate"
        ]
      },
      {
        "step": 6,
        "operation_id": "createPackage",
        "method": "post",
        "path_template": "/projects/{project_id}/packages",
        "requires_idempotency_key": true,
        "request_schema": "PackageCreate",
        "success_status": "201",
        "response_schema": "Package",
        "path_params": [
          "project_id"
        ],
        "body_assertions": [
          "items include hero_product_ad.png, square_social_ad.png, story_variant.png, marketplace_banner.png"
        ]
      },
      {
        "step": 7,
        "operation_id": "createExport",
        "method": "post",
        "path_template": "/packages/{package_id}/exports",
        "requires_idempotency_key": true,
        "request_schema": "ExportCreate",
        "success_status": "202",
        "response_schema": "TaskStatus",
        "path_params": [
          "package_id"
        ],
        "body_assertions": [
          "format equals zip"
        ]
      },
      {
        "step": 8,
        "operation_id": "getExport",
        "method": "get",
        "path_template": "/exports/{export_id}",
        "requires_idempotency_key": false,
        "request_schema": "none",
        "success_status": "200",
        "response_schema": "Export",
        "path_params": [
          "export_id"
        ],
        "body_assertions": [
          "manifest, metadata, qa_report, trace_provenance, and required asset files are present",
          "download_url is short-lived when export is ready"
        ]
      }
    ],
    "expected_runtime_assertions": [
      "brief with product_name, product_image, target_channel produces four candidates",
      "candidate assets cover all four strategy taxonomy entries",
      "selected direction can be packaged with all required outputs",
      "export blocks when required manifest, QA report, metadata, or trace provenance is missing"
    ]
  },
  "playwright_happy_path_contract": {
    "execution_status": "not_executed",
    "blueprint_checklist_remains_open": true,
    "start_route": "/projects/new?workflow=ecommerce_growth_pack",
    "completion_route": "/projects/{project_id}/exports/{export_id}",
    "expected_user_steps": [
      "create project",
      "enter ecommerce brief",
      "upload product image",
      "review four candidates",
      "select one direction",
      "iterate selected direction",
      "add assets to package",
      "preview and download export"
    ],
    "required_selectors": [
      "[data-testid=\"project-create\"]",
      "[data-testid=\"workflow-ecommerce_growth_pack\"]",
      "[data-testid=\"brief-product_name\"]",
      "[data-testid=\"brief-target_channel\"]",
      "[data-testid=\"brief-offer\"]",
      "[data-testid=\"reference-upload-product_image\"]",
      "[data-testid=\"generate-candidates\"]",
      "[data-testid=\"candidate-grid\"]",
      "[data-testid=\"candidate-card-conversion_offer\"]",
      "[data-testid=\"candidate-select\"]",
      "[data-testid=\"iterate-selected-direction\"]",
      "[data-testid=\"package-add-selected\"]",
      "[data-testid=\"export-preview\"]",
      "[data-testid=\"export-download\"]"
    ],
    "user_journey": [
      {
        "step": 1,
        "action": "create_project",
        "route": "/projects/new?workflow=ecommerce_growth_pack",
        "selector": "[data-testid=\"project-create\"]",
        "assertions": [
          "project workspace route opens with workflow=ecommerce_growth_pack"
        ]
      },
      {
        "step": 2,
        "action": "fill_brief",
        "route": "/projects/{project_id}",
        "selector": "[data-testid=\"brief-product_name\"]",
        "assertions": [
          "product_name is captured in brief",